{
  "format": "shpd.docs.document",
  "formatVersion": "1.0",
  "docType": "invoiceReceived",
  "docNumber": "2026/0951",
  "selfParty": "customer",
  "supplier": {
    "name": "Papírnictví Kvadrát s.r.o.",
    "country": "cz",
    "companyId": "56546939",
    "taxId": "CZ56546939",
    "vatId": "CZ56546939",
    "courtRegistration": "Spisová značka C 301877 vedená u Městského soudu v Praze",
    "address": {
      "street": "Sešitová",
      "houseNumber": "3",
      "city": "Praha 1",
      "zip": "11000",
      "country": "cz"
    },
    "contact": {
      "name": null,
      "email": "objednavky@kvadrat-papir.example",
      "phone": "+420224815770",
      "web": "www.kvadrat-papir.example"
    },
    "bankAccount": {
      "accountNumber": "9092871663/5500",
      "iban": "CZ8255000000009092871663",
      "bic": "RZBCCZPP"
    }
  },
  "customer": {
    "name": "Tvarokov s.r.o.",
    "country": "cz",
    "companyId": "27893286",
    "taxId": "CZ27893286",
    "vatId": "CZ27893286",
    "courtRegistration": null,
    "address": {
      "street": "Lisovací",
      "houseNumber": "418/2",
      "city": "Zlín",
      "zip": "76001",
      "country": "cz"
    },
    "contact": {
      "name": null,
      "email": null,
      "phone": null,
      "web": null
    },
    "bankAccount": {
      "accountNumber": null,
      "iban": null,
      "bic": null
    }
  },
  "dates": {
    "issueDate": "2026-09-15",
    "dueDate": "2026-09-29",
    "taxPointDate": "2026-09-15",
    "periodFrom": null,
    "periodTo": null
  },
  "currency": "CZK",
  "exchangeRate": null,
  "vat": {
    "mode": "fromBase",
    "place": "domestic",
    "reverseCharge": false
  },
  "payment": {
    "method": "bankTransfer",
    "paymentReference": "20260951",
    "specificSymbol": null,
    "constantSymbol": null
  },
  "notes": {
    "onDocument": "Děkujeme za objednávku."
  },
  "rows": [
    {
      "rowKind": "item",
      "item": {
        "supplierCode": "POR-A4-75",
        "ean": null,
        "name": "Pákový pořadač A4, 75 mm, modrý",
        "description": null
      },
      "unit": "ks",
      "quantity": 20,
      "unitPrice": 54.90,
      "totalPrice": 1098.00,
      "priceCalcMode": "fromUnitPrice",
      "discountPct": null,
      "discountAmount": null,
      "vat": {
        "pct": 21,
        "supplyKind": null,
        "reverseChargeCode": null
      }
    },
    {
      "rowKind": "item",
      "item": {
        "supplierCode": "OB-C5",
        "ean": null,
        "name": "Obálky C5 samolepicí, bílé",
        "description": null
      },
      "unit": "ks",
      "quantity": 1000,
      "unitPrice": 0.95,
      "totalPrice": 950.00,
      "priceCalcMode": "fromUnitPrice",
      "discountPct": null,
      "discountAmount": null,
      "vat": {
        "pct": 21,
        "supplyKind": null,
        "reverseChargeCode": null
      }
    },
    {
      "rowKind": "item",
      "item": {
        "supplierCode": "LB-76",
        "ean": null,
        "name": "Lepicí bloky 76×76 mm, žluté",
        "description": null
      },
      "unit": "ks",
      "quantity": 12,
      "unitPrice": 19.50,
      "totalPrice": 234.00,
      "priceCalcMode": "fromUnitPrice",
      "discountPct": null,
      "discountAmount": null,
      "vat": {
        "pct": 21,
        "supplyKind": null,
        "reverseChargeCode": null
      }
    },
    {
      "rowKind": "item",
      "item": {
        "supplierCode": null,
        "ean": null,
        "name": "Předplatné časopisu Mzdová praxe 10–12/2026",
        "description": null
      },
      "unit": "ks",
      "quantity": 1,
      "unitPrice": 450.00,
      "totalPrice": 450.00,
      "priceCalcMode": "fromUnitPrice",
      "discountPct": null,
      "discountAmount": null,
      "vat": {
        "pct": 12,
        "supplyKind": null,
        "reverseChargeCode": null
      }
    }
  ],
  "vatRecap": [
    {
      "vatPct": 21,
      "base": 2282.00,
      "tax": 479.22,
      "total": 2761.22
    },
    {
      "vatPct": 12,
      "base": 450.00,
      "tax": 54.00,
      "total": 504.00
    }
  ],
  "totals": {
    "totalBase": 2732.00,
    "totalVat": 533.22,
    "totalAmount": 3265.22,
    "totalRounding": 0
  },
  "_resolve": {
    "contentTag": {
      "tag": "office.supplies",
      "rowExceptions": [
        {
          "rowIndex": 3,
          "tag": "admin.memberships"
        }
      ]
    }
  }
}
