{
  "format": "shpd.docs.document",
  "formatVersion": "1.0",
  "docType": "invoiceIssued",
  "docNumber": "FV-2026-0105",
  "selfParty": "supplier",
  "supplier": {
    "name": "Alfa Nábytek s.r.o.",
    "country": "cz",
    "companyId": "12345678",
    "taxId": "CZ12345678",
    "vatId": "CZ12345678",
    "courtRegistration": "C 12345 vedená u Krajského soudu v Brně",
    "address": {
      "street": "Výrobní",
      "houseNumber": "1230/5",
      "city": "Brno",
      "zip": "61600",
      "country": "cz"
    },
    "contact": {
      "name": null,
      "email": "fakturace@alfa-nabytek.example",
      "phone": "+420511222333",
      "web": "www.alfa-nabytek.example"
    },
    "bankAccount": {
      "accountNumber": "123457/0100",
      "iban": null,
      "bic": null
    }
  },
  "customer": {
    "name": "Beta Kanceláře a.s.",
    "country": "cz",
    "companyId": "87654321",
    "taxId": "CZ87654321",
    "vatId": "CZ87654321",
    "courtRegistration": null,
    "address": {
      "street": "Kancelářská",
      "houseNumber": "7",
      "city": "Praha 4",
      "zip": "14000",
      "country": "cz"
    },
    "contact": {
      "name": "Petr Odběratel",
      "email": null,
      "phone": null,
      "web": null
    },
    "bankAccount": {
      "accountNumber": null,
      "iban": null,
      "bic": null
    }
  },
  "dates": {
    "issueDate": "2026-09-30",
    "dueDate": "2026-10-14",
    "taxPointDate": "2026-09-30",
    "periodFrom": null,
    "periodTo": null
  },
  "currency": "CZK",
  "exchangeRate": null,
  "vat": {
    "mode": "fromBase",
    "place": "domestic",
    "reverseCharge": false
  },
  "payment": {
    "method": "bankTransfer",
    "paymentReference": "20260105",
    "specificSymbol": null,
    "constantSymbol": null
  },
  "notes": {
    "onDocument": null
  },
  "rows": [
    {
      "rowKind": "text",
      "item": {
        "supplierCode": null,
        "ean": null,
        "name": "Dodávka za září 2026",
        "description": null
      },
      "unit": null,
      "quantity": null,
      "unitPrice": null,
      "totalPrice": null,
      "priceCalcMode": null,
      "discountPct": null,
      "discountAmount": null,
      "vat": {
        "pct": null,
        "supplyKind": null,
        "reverseChargeCode": null
      },
      "computed": null
    },
    {
      "rowKind": "item",
      "item": {
        "supplierCode": null,
        "ean": null,
        "name": "Hosting",
        "description": null
      },
      "unit": "měs",
      "quantity": 1,
      "unitPrice": 990,
      "totalPrice": 990,
      "priceCalcMode": "fromUnitPrice",
      "discountPct": null,
      "discountAmount": null,
      "vat": {
        "pct": 21,
        "supplyKind": null,
        "reverseChargeCode": null
      },
      "computed": {
        "vatBase": 990,
        "vatAmount": 207.9,
        "vatTotal": 1197.9
      }
    },
    {
      "rowKind": "section",
      "item": {
        "supplierCode": null,
        "ean": null,
        "name": "Doplňkové služby",
        "description": null
      },
      "unit": null,
      "quantity": null,
      "unitPrice": null,
      "totalPrice": null,
      "priceCalcMode": null,
      "discountPct": null,
      "discountAmount": null,
      "vat": {
        "pct": null,
        "supplyKind": null,
        "reverseChargeCode": null
      },
      "computed": null
    },
    {
      "rowKind": "item",
      "item": {
        "supplierCode": null,
        "ean": null,
        "name": "Doména",
        "description": null
      },
      "unit": "ks",
      "quantity": 1,
      "unitPrice": 290,
      "totalPrice": 290,
      "priceCalcMode": "fromUnitPrice",
      "discountPct": null,
      "discountAmount": null,
      "vat": {
        "pct": 21,
        "supplyKind": null,
        "reverseChargeCode": null
      },
      "computed": {
        "vatBase": 290,
        "vatAmount": 60.9,
        "vatTotal": 350.9
      }
    }
  ],
  "vatRecap": [
    {
      "vatPct": 21,
      "base": 1280,
      "tax": 268.8,
      "total": 1548.8
    }
  ],
  "totals": {
    "totalBase": 1280,
    "totalVat": 268.8,
    "totalAmount": 1548.8,
    "totalRounding": 0
  }
}
