{
  "format": "shpd.docs.document",
  "formatVersion": "1.0",
  "docType": "invoiceReceived",
  "docNumber": "2026/0882",
  "selfParty": "customer",
  "supplier": {
    "name": "Papírnictví Kvadrát s.r.o.",
    "country": "cz",
    "companyId": "56546939",
    "taxId": "CZ56546939",
    "vatId": "CZ56546939",
    "courtRegistration": "Spisová značka C 991877 vedená u Městského soudu v Praze",
    "address": {
      "street": "Sešitová",
      "houseNumber": "3",
      "city": "Praha 1",
      "zip": "11000",
      "country": "cz"
    },
    "contact": {
      "name": null,
      "email": "objednavky@kvadrat-papir.example",
      "phone": "+420000815770",
      "web": "www.kvadrat-papir.example"
    },
    "bankAccount": {
      "accountNumber": "9092871663/5500",
      "iban": "CZ8255000000009092871663",
      "bic": "RZBCCZPP"
    }
  },
  "customer": {
    "name": "Kreslírna Modrá s.r.o.",
    "country": "cz",
    "companyId": "68040725",
    "taxId": null,
    "vatId": null,
    "courtRegistration": null,
    "address": {
      "street": "Náčrtková",
      "houseNumber": "15",
      "city": "Brno",
      "zip": "60200",
      "country": "cz"
    },
    "contact": {
      "name": null,
      "email": null,
      "phone": null,
      "web": null
    },
    "bankAccount": {
      "accountNumber": null,
      "iban": null,
      "bic": null
    }
  },
  "dates": {
    "issueDate": "2026-08-20",
    "dueDate": "2026-09-03",
    "taxPointDate": "2026-08-20",
    "periodFrom": null,
    "periodTo": null
  },
  "currency": "CZK",
  "exchangeRate": null,
  "vat": {
    "mode": "fromBase",
    "place": "domestic",
    "reverseCharge": false
  },
  "payment": {
    "method": "bankTransfer",
    "paymentReference": "20260882",
    "specificSymbol": null,
    "constantSymbol": null
  },
  "notes": {
    "onDocument": "Děkujeme za objednávku. Při platbě uvádějte variabilní symbol."
  },
  "rows": [
    {
      "rowKind": "item",
      "item": {
        "supplierCode": "PAP-A4-80",
        "ean": null,
        "name": "Kancelářský papír A4 80 g, 5× 500 listů",
        "description": null
      },
      "unit": "bal",
      "quantity": 10,
      "unitPrice": 129.00,
      "totalPrice": 1290.00,
      "priceCalcMode": "fromUnitPrice",
      "discountPct": null,
      "discountAmount": null,
      "vat": {
        "pct": 21,
        "supplyKind": null,
        "reverseChargeCode": null
      }
    },
    {
      "rowKind": "item",
      "item": {
        "supplierCode": "TON-85A",
        "ean": null,
        "name": "Toner černý, kompatibilní s HP 85A",
        "description": null
      },
      "unit": "ks",
      "quantity": 2,
      "unitPrice": 1190.00,
      "totalPrice": 2380.00,
      "priceCalcMode": "fromUnitPrice",
      "discountPct": null,
      "discountAmount": null,
      "vat": {
        "pct": 21,
        "supplyKind": null,
        "reverseChargeCode": null
      }
    },
    {
      "rowKind": "item",
      "item": {
        "supplierCode": null,
        "ean": null,
        "name": "Předplatné časopisu Daně a účetnictví 9–12/2026",
        "description": null
      },
      "unit": "ks",
      "quantity": 1,
      "unitPrice": 822.00,
      "totalPrice": 822.00,
      "priceCalcMode": "fromUnitPrice",
      "discountPct": null,
      "discountAmount": null,
      "vat": {
        "pct": 12,
        "supplyKind": null,
        "reverseChargeCode": null
      }
    },
    {
      "rowKind": "item",
      "item": {
        "supplierCode": null,
        "ean": null,
        "name": "Odborný čtvrtletník Mzdová praxe — předplatné 4 čísla",
        "description": null
      },
      "unit": "ks",
      "quantity": 1,
      "unitPrice": 390.00,
      "totalPrice": 390.00,
      "priceCalcMode": "fromUnitPrice",
      "discountPct": null,
      "discountAmount": null,
      "vat": {
        "pct": 12,
        "supplyKind": null,
        "reverseChargeCode": null
      }
    }
  ],
  "vatRecap": [
    {
      "vatPct": 21,
      "base": 3670.00,
      "tax": 770.70,
      "total": 4440.70
    },
    {
      "vatPct": 12,
      "base": 1212.00,
      "tax": 145.44,
      "total": 1357.44
    }
  ],
  "totals": {
    "totalBase": 4882.00,
    "totalVat": 916.14,
    "totalAmount": 5798.14,
    "totalRounding": 0
  },
  "_resolve": {
    "contentTag": {
      "tag": "office.supplies",
      "rowExceptions": [
        {
          "rowIndex": 2,
          "tag": "admin.memberships"
        },
        {
          "rowIndex": 3,
          "tag": "admin.memberships"
        }
      ]
    }
  }
}
