{
  "format": "shpd.docs.document",
  "formatVersion": "1.0",
  "docType": "invoiceReceived",
  "docNumber": "RE-2026-08102",
  "selfParty": "customer",
  "supplier": {
    "name": "Nordlicht Hardware GmbH",
    "country": "de",
    "companyId": null,
    "taxId": null,
    "vatId": "DE810932557",
    "courtRegistration": "Amtsgericht Hamburg, HRB 998765",
    "address": {
      "street": "Industriestraße",
      "houseNumber": "42",
      "city": "Hamburg",
      "zip": "20457",
      "country": "de"
    },
    "contact": {
      "name": null,
      "email": "sales@nordlicht-hardware.example",
      "phone": "+490007005120",
      "web": "www.nordlicht-hardware.example"
    },
    "bankAccount": {
      "accountNumber": null,
      "iban": "DE39200505507423852329",
      "bic": "NDLTDEHHXXX"
    }
  },
  "customer": {
    "name": "Tvarokov s.r.o.",
    "country": "cz",
    "companyId": "27893286",
    "taxId": "CZ27893286",
    "vatId": "CZ27893286",
    "courtRegistration": null,
    "address": {
      "street": "Lisovací",
      "houseNumber": "418/2",
      "city": "Zlín",
      "zip": "76001",
      "country": "cz"
    },
    "contact": {
      "name": null,
      "email": null,
      "phone": null,
      "web": null
    },
    "bankAccount": {
      "accountNumber": null,
      "iban": null,
      "bic": null
    }
  },
  "dates": {
    "issueDate": "2026-09-23",
    "dueDate": "2026-10-07",
    "taxPointDate": "2026-09-22",
    "periodFrom": null,
    "periodTo": null
  },
  "currency": "EUR",
  "exchangeRate": null,
  "vat": {
    "mode": "fromBase",
    "place": "intracom",
    "reverseCharge": false
  },
  "payment": {
    "method": "bankTransfer",
    "paymentReference": null,
    "specificSymbol": null,
    "constantSymbol": null
  },
  "notes": {
    "onDocument": "Goods remain our property until paid in full."
  },
  "rows": [
    {
      "rowKind": "item",
      "item": {
        "supplierCode": "MON-27-4K",
        "ean": "4260999100020",
        "name": "27\" 4K monitor, USB-C, height adjustable",
        "description": null
      },
      "unit": "pcs",
      "quantity": 4,
      "unitPrice": 329.00,
      "totalPrice": 1316.00,
      "priceCalcMode": "fromUnitPrice",
      "discountPct": null,
      "discountAmount": null,
      "vat": {
        "pct": 0,
        "supplyKind": "goods",
        "reverseChargeCode": null
      }
    },
    {
      "rowKind": "item",
      "item": {
        "supplierCode": "DOCK-UC-100",
        "ean": null,
        "name": "USB-C docking station, 2× DP, 100 W PD",
        "description": null
      },
      "unit": "pcs",
      "quantity": 4,
      "unitPrice": 149.00,
      "totalPrice": 566.20,
      "priceCalcMode": "fromUnitPrice",
      "discountPct": 5,
      "discountAmount": null,
      "vat": {
        "pct": 0,
        "supplyKind": "goods",
        "reverseChargeCode": null
      }
    },
    {
      "rowKind": "item",
      "item": {
        "supplierCode": null,
        "ean": null,
        "name": "Shipping (parcel, insured)",
        "description": null
      },
      "unit": "pcs",
      "quantity": 1,
      "unitPrice": 45.00,
      "totalPrice": 45.00,
      "priceCalcMode": "fromUnitPrice",
      "discountPct": null,
      "discountAmount": null,
      "vat": {
        "pct": 0,
        "supplyKind": "services",
        "reverseChargeCode": null
      }
    }
  ],
  "vatRecap": [
    {
      "vatPct": 0,
      "base": 1927.20,
      "tax": 0.00,
      "total": 1927.20
    }
  ],
  "totals": {
    "totalBase": 1927.20,
    "totalVat": 0.00,
    "totalAmount": 1927.20,
    "totalRounding": 0
  },
  "_resolve": {
    "contentTag": {
      "tag": "it.hardware",
      "rowExceptions": [
        {
          "rowIndex": 2,
          "tag": "services.shipping"
        }
      ]
    }
  }
}
